{
  "id": "ga4gh:VA.Dy7soaZQU1vH9Eb93xG_pJyhu7xTDDC9",
  "type": "Allele",
  "name": "NP_006197.1:p.Asp842Val",
  "aliases": [
    "NP_006197.1:p.D842V",
    "PDGFRA p.D842V"
  ],
  "description": "VRS variation of NP_006197.1:p.Asp842Val",
  "digest": "Dy7soaZQU1vH9Eb93xG_pJyhu7xTDDC9",
  "expressions": [
    {
      "syntax": "hgvs.p",
      "value": "NP_006197.1:p.Asp842Val",
      "extensions": [
        {
          "name": "hgvs.p_short",
          "value": "p.D842V"
        }
      ]
    }
  ],
  "location": {
    "id": "ga4gh:SL.xuh2OFm73UN7_0uLySrRY2Xe3FW7KJ5h",
    "type": "SequenceLocation",
    "name": null,
    "aliases": [],
    "description": "Amino acid position 842 of the Refseq protein NP_006197.1, which is the protein product of the MANE Select coding transcript for PDGFRA (refseq:NM_006206.6).",
    "digest": "xuh2OFm73UN7_0uLySrRY2Xe3FW7KJ5h",
    "sequenceReference": {
      "id": "ga4gh:SQ.XpQn9sZLGv_GU3uiWO7YHq9-_alGjrVX",
      "type": "SequenceReference",
      "name": "NP_006197.1",
      "aliases": [
        "ensembl:ENSP00000257290.5",
        "ga4gh:SQ.XpQn9sZLGv_GU3uiWO7YHq9-_alGjrVX",
        "refseq:NP_006197.1"
      ],
      "description": "The protein product of the MANE Select coding transcript for PDGFRA (refseq:NM_006206.6), corresponding to the Refseq protein accession NP_006197.1.",
      "moleculeType": "protein",
      "refgetAccession": "SQ.XpQn9sZLGv_GU3uiWO7YHq9-_alGjrVX",
      "residueAlphabet": "aa"
    },
    "start": 841,
    "end": 842,
    "sequence": "D"
  },
  "state": {
    "type": "LiteralSequenceExpression",
    "sequence": "V"
  }
}